{
  "segment": "UB2",
  "name": "UB92 Data",
  "description": "Contains UB-92 institutional billing form data for hospital and facility billing",
  "standard": "hl7v23",
  "version": "2.3",
  "usage": "O",
  "cardinality": {
    "min": 0,
    "max": 1
  },
  "fields": {
    "UB2.1": {
      "name": "Set ID - UB2",
      "description": "Sequence number for UB2 segments",
      "dataType": "SI",
      "usage": "O",
      "cardinality": {"min": 0, "max": 1},
      "examples": ["1", "2", "3"]
    },
    "UB2.2": {
      "name": "Co-Insurance Days",
      "description": "Number of coinsurance days",
      "dataType": "ST",
      "usage": "O",
      "cardinality": {"min": 0, "max": 1},
      "examples": ["30", "60", "90"]
    },
    "UB2.3": {
      "name": "Condition Code",
      "description": "Condition codes for billing circumstances",
      "dataType": "ID",
      "usage": "O",
      "cardinality": {"min": 0, "max": 7},
      "table": "0043",
      "examples": ["01", "02", "03"]
    },
    "UB2.4": {
      "name": "Covered Days",
      "description": "Number of covered days",
      "dataType": "ST",
      "usage": "O",
      "cardinality": {"min": 0, "max": 1},
      "examples": ["5", "10", "15"]
    },
    "UB2.5": {
      "name": "Non-Covered Days",
      "description": "Number of non-covered days",
      "dataType": "ST",
      "usage": "O",
      "cardinality": {"min": 0, "max": 1},
      "examples": ["0", "2", "3"]
    },
    "UB2.6": {
      "name": "Value Amount & Code",
      "description": "Value amounts and codes for billing",
      "dataType": "CM_UVC",
      "usage": "O",
      "cardinality": {"min": 0, "max": 12}
    },
    "UB2.7": {
      "name": "Occurrence Code & Date",
      "description": "Occurrence codes and associated dates",
      "dataType": "CM_OCD",
      "usage": "O",
      "cardinality": {"min": 0, "max": 8}
    },
    "UB2.8": {
      "name": "Occurrence Span Code/Dates",
      "description": "Occurrence span codes with start and end dates",
      "dataType": "CM_OSP",
      "usage": "O",
      "cardinality": {"min": 0, "max": 2}
    },
    "UB2.9": {
      "name": "UB92 Locator 2",
      "description": "UB-92 form locator 2 data",
      "dataType": "ST",
      "usage": "O",
      "cardinality": {"min": 0, "max": 2},
      "examples": ["STATEMENT FROM", "STATEMENT TO"]
    },
    "UB2.10": {
      "name": "UB92 Locator 11",
      "description": "UB-92 form locator 11 data",
      "dataType": "ST",
      "usage": "O",
      "cardinality": {"min": 0, "max": 2},
      "examples": ["PATIENT ID", "CONTROL NUMBER"]
    },
    "UB2.11": {
      "name": "UB92 Locator 31",
      "description": "UB-92 form locator 31 data",
      "dataType": "ST",
      "usage": "O",
      "cardinality": {"min": 0, "max": 1},
      "examples": ["31A", "31B"]
    },
    "UB2.12": {
      "name": "Document Control Number",
      "description": "Document control number for billing",
      "dataType": "ST",
      "usage": "O",
      "cardinality": {"min": 0, "max": 3},
      "examples": ["DCN123456", "CTRL789012"]
    },
    "UB2.13": {
      "name": "UB92 Locator 49",
      "description": "UB-92 form locator 49 data",
      "dataType": "ST",
      "usage": "O",
      "cardinality": {"min": 0, "max": 23},
      "examples": ["49A", "49B", "49C"]
    },
    "UB2.14": {
      "name": "UB92 Locator 56",
      "description": "UB-92 form locator 56 data",
      "dataType": "ST",
      "usage": "O",
      "cardinality": {"min": 0, "max": 5},
      "examples": ["56A", "56B"]
    },
    "UB2.15": {
      "name": "UB92 Locator 57",
      "description": "UB-92 form locator 57 data",
      "dataType": "ST",
      "usage": "O",
      "cardinality": {"min": 0, "max": 1},
      "examples": ["NATIONAL PROVIDER ID"]
    },
    "UB2.16": {
      "name": "UB92 Locator 78",
      "description": "UB-92 form locator 78 data",
      "dataType": "ST",
      "usage": "O",
      "cardinality": {"min": 0, "max": 2},
      "examples": ["78A", "78B"]
    },
    "UB2.17": {
      "name": "Special Visit Count",
      "description": "Count of special visits",
      "dataType": "NM",
      "usage": "O",
      "cardinality": {"min": 0, "max": 1},
      "examples": ["1", "2", "3"]
    }
  },
  "examples": [
    "UB2|1|30|01~02|5|0||||STATEMENT FROM|PATIENT ID|31A|DCN123456|49A|56A|NATIONAL PROVIDER ID|78A|1",
    "UB2|2|60|03~04|10|2||||STATEMENT TO|CONTROL NUMBER|31B|CTRL789012|49B|56B||78B|2"
  ],
  "notes": [
    "All UB2 fields are optional - provides UB-92 institutional billing form data",
    "Enhanced version of UB1 with additional locator fields and data",
    "Used for hospital and facility billing with more detailed reporting requirements"
  ]
}