{
  "segment": "UB1",
  "name": "UB82 Data",
  "description": "Contains UB-82 institutional billing form data for hospital and facility billing",
  "standard": "hl7v23",
  "version": "2.3",
  "usage": "O",
  "cardinality": {
    "min": 0,
    "max": 1
  },
  "fields": {
    "UB1.1": {
      "name": "Set ID - UB1",
      "description": "Sequence number for UB1 segments",
      "dataType": "SI",
      "usage": "O",
      "cardinality": {"min": 0, "max": 1},
      "examples": ["1", "2", "3"]
    },
    "UB1.2": {
      "name": "Blood Deductible",
      "description": "Blood deductible amount indicator",
      "dataType": "NM",
      "usage": "O",
      "cardinality": {"min": 0, "max": 1},
      "examples": ["0", "1"]
    },
    "UB1.3": {
      "name": "Blood Furnished Pints Of",
      "description": "Number of pints of blood furnished",
      "dataType": "NM",
      "usage": "O",
      "cardinality": {"min": 0, "max": 1},
      "examples": ["2", "4", "6"]
    },
    "UB1.4": {
      "name": "Blood Replaced Pints",
      "description": "Number of pints of blood replaced",
      "dataType": "NM",
      "usage": "O",
      "cardinality": {"min": 0, "max": 1},
      "examples": ["2", "3", "4"]
    },
    "UB1.5": {
      "name": "Blood Not Replaced Pints",
      "description": "Number of pints of blood not replaced",
      "dataType": "NM",
      "usage": "O",
      "cardinality": {"min": 0, "max": 1},
      "examples": ["0", "1", "2"]
    },
    "UB1.6": {
      "name": "Co Insurance Days",
      "description": "Number of coinsurance days",
      "dataType": "NM",
      "usage": "O",
      "cardinality": {"min": 0, "max": 1},
      "examples": ["30", "60", "90"]
    },
    "UB1.7": {
      "name": "Condition Code",
      "description": "Condition codes for billing circumstances",
      "dataType": "IS",
      "usage": "O",
      "cardinality": {"min": 0, "max": 5},
      "table": "0043",
      "examples": ["01", "02", "03"]
    },
    "UB1.8": {
      "name": "Covered Days",
      "description": "Number of covered days",
      "dataType": "NM",
      "usage": "O",
      "cardinality": {"min": 0, "max": 1},
      "examples": ["5", "10", "15"]
    },
    "UB1.9": {
      "name": "Non Covered Days",
      "description": "Number of non-covered days",
      "dataType": "NM",
      "usage": "O",
      "cardinality": {"min": 0, "max": 1},
      "examples": ["0", "2", "3"]
    },
    "UB1.10": {
      "name": "Value Amount & Code",
      "description": "Value amounts and codes for billing",
      "dataType": "CM_UVC",
      "usage": "O",
      "cardinality": {"min": 0, "max": 8}
    },
    "UB1.11": {
      "name": "Number Of Grace Days",
      "description": "Number of grace days allowed",
      "dataType": "NM",
      "usage": "O",
      "cardinality": {"min": 0, "max": 1},
      "examples": ["3", "5", "7"]
    },
    "UB1.12": {
      "name": "Spec Program Indicator",
      "description": "Special program indicator",
      "dataType": "CE",
      "usage": "O",
      "cardinality": {"min": 0, "max": 1},
      "examples": ["MEDICARE^Medicare Program", "MEDICAID^Medicaid Program"]
    },
    "UB1.13": {
      "name": "PSRO/UR Approval Indicator",
      "description": "Professional Standards Review Organization approval indicator",
      "dataType": "ID",
      "usage": "O",
      "cardinality": {"min": 0, "max": 1},
      "examples": ["Y", "N"]
    },
    "UB1.14": {
      "name": "PSRO/UR Approved Stay Fm",
      "description": "PSRO approved stay from date",
      "dataType": "DT",
      "usage": "O",
      "cardinality": {"min": 0, "max": 1},
      "examples": ["20220815", "20221201"]
    },
    "UB1.15": {
      "name": "PSRO/UR Approved Stay To",
      "description": "PSRO approved stay to date",
      "dataType": "DT",
      "usage": "O",
      "cardinality": {"min": 0, "max": 1},
      "examples": ["20220820", "20221205"]
    },
    "UB1.16": {
      "name": "Occurrence",
      "description": "Occurrence codes and dates",
      "dataType": "CM_OCD",
      "usage": "O",
      "cardinality": {"min": 0, "max": 5}
    },
    "UB1.17": {
      "name": "Occurrence Span",
      "description": "Occurrence span code",
      "dataType": "ID",
      "usage": "O",
      "cardinality": {"min": 0, "max": 1},
      "examples": ["72", "73", "74"]
    },
    "UB1.18": {
      "name": "Occur Span Start Date",
      "description": "Occurrence span start date",
      "dataType": "DT",
      "usage": "O",
      "cardinality": {"min": 0, "max": 1},
      "examples": ["20220815", "20221201"]
    },
    "UB1.19": {
      "name": "Occur Span End Date",
      "description": "Occurrence span end date",
      "dataType": "DT",
      "usage": "O",
      "cardinality": {"min": 0, "max": 1},
      "examples": ["20220820", "20221205"]
    },
    "UB1.20": {
      "name": "UB 82 Locator 2",
      "description": "UB-82 form locator 2 data",
      "dataType": "ST",
      "usage": "O",
      "cardinality": {"min": 0, "max": 1},
      "examples": ["STATEMENT FROM", "STATEMENT TO"]
    },
    "UB1.21": {
      "name": "UB 82 Locator 9",
      "description": "UB-82 form locator 9 data",
      "dataType": "ST",
      "usage": "O",
      "cardinality": {"min": 0, "max": 1},
      "examples": ["123456", "PATIENT"]
    },
    "UB1.22": {
      "name": "UB 82 Locator 27",
      "description": "UB-82 form locator 27 data",
      "dataType": "ST",
      "usage": "O",
      "cardinality": {"min": 0, "max": 1},
      "examples": ["ACCT123", "BILLING"]
    },
    "UB1.23": {
      "name": "UB 82 Locator 45",
      "description": "UB-82 form locator 45 data",
      "dataType": "ST",
      "usage": "O",
      "cardinality": {"min": 0, "max": 1},
      "examples": ["DISCHARGE DATE", "ADMISSION DATE"]
    }
  },
  "examples": [
    "UB1|1|0|2|2|0|30|01|5|0|||MEDICARE^Medicare Program|Y|20220815|20220820||||||||",
    "UB1|2|1|4|3|1|60|02~03|10|2|||MEDICAID^Medicaid Program|N|20221201|20221205||||||||"
  ],
  "notes": [
    "All UB1 fields are optional - provides UB-82 institutional billing form data",
    "Used for hospital and facility billing to government and private payers",
    "Contains detailed institutional billing information and occurrence codes"
  ]
}